{
  "schemaVersion": "1.1",
  "reportId": "report-empty",
  "batchId": "fb-001",
  "itemId": "item-001",
  "baseSha": "base",
  "headSha": "head",
  "anchor": {
    "type": "change",
    "ref": "change-001",
    "fingerprint": "00000000"
  },
  "question": "Why did this change?",
  "code": [],
  "images": [],
  "evidenceRefs": [],
  "priorThreadMessages": [{ "role": "human", "text": "Why did this change?" }],
  "redactions": [],
  "contextHash": "00000000"
}
